{
  "date": "2025/11/01",
  "title": "Paper accepted",
  "description": "Saja's paper on positioning a taxonomy of interpretation and explanation methods for Capsule Networks was accepted in the journal Neurocomputing.",
  "link": "https://www.sciencedirect.com/science/article/abs/pii/S0925231225026979"
}
